date,label,category,title,mksa,content,harga yang dicari
5/2/2022,up,Finansial,Boom… US$ 90/barel minyak AS pecah rekor,Intinya...Harga Minyak Amerika Serikat memecahkan rekor tertinggi sejak 2014. Harga minyak mentah naik 2.2% menjadi US$ 90.15 per barel pada basis intraday sejak 2014. Keputusan penolakan untuk meningkatkan produksi secara agresif oleh OPEC dan sekutunya memicu reli harga minyak AS serta kekhawatiran pasokan karena cuaca dingin di seluruh AS.,"Minyak mentah Brent sebagai patokan dunia ditutup diatas US$ 90 per barel. Harga minyak AS melonjak setelah OPEC dan sekutunya menolak meningkatkan produksi serta kekhawatiran ketersediaan pasokan karena cuaca dingin di seluruh AS.. Minyak mentah melonjak 2,2% pada perdagangan sore sekaligus menandai harga minyak AS menembus rekor pada basis intraday sejak oktober 2014. Di tengah dampak dari intervensi pemimpin AS ke pasar energi dan kekhawatiran Omicron, pada 1 Desember 2021 harga minyak ditutup pada level terendah di US$ 65.57 per barel dan telah melonjak 37%. 200.000 orang lebih kehilangan listrik karena cuaca dingin di seluruh Amerika Serikat. Ingatan badai Ida tahun lalu menjadi sorotan karena mematikan listrik bagi jutaan orang Texas. ""Ini histeria atau semacam ketakutan,"" kata Bob Yawger, direktur energi berjangka di Mizuho seperti dikutip Reuters. Beberapa orang di Wall Street menyarankan OPEC+ agar dapat meningkatkan produksi secara lebih substansial untuk memenuhi permintaan pasar. OPEC+ mengumumkan akan tetap mengikuti rencana sebelumnya untuk meningkatkan produksi sebesar 400.000 barel per hari. Melansir dari Detik Finance ""OPEC+ memilih untuk mengadakan pertemuan terpendek dalam catatan dan menghentikan kenaikan bulanan 400 kb/d, bertahan dengan pendekatan manajemen lepas tangan meskipun ada ketakutan inflasi global,"" tulis ahli strategi RBC Capital Markets dalam sebuah catatan kepada klien. Harga minyak Brent dapat menyentuh US$100 per barel pada kuartal ketiga menurut perkiraan Analis Goldman Sachs. Pelanggaran pemotongan produksi yang lebih cepat dapat dipertimbangkan oleh OPEC+.", minyak mentah
6/2/2022,down,Finansial,Mark Zuckerberg masih jadi orang terkaya?,"Intinya...Mark Zuckerberg terancam keluar dari daftar 10 orang terkaya dunia gara-gara harga saham induk perusahaan Instagram dan Facebook alias Meta Platform Inc merosot hingga 26% atau menyusut US$31 miliar yang setara Rp445,78 triliun (kurs Rp14.380).","Saham Meta Platform Inc tercatat merosot hingga 26% pada perdagangan Kamis (3/2) beserta laporan kinerja kuartal 4 yang mengecewakan. Penurunan saham perusahaan Meta ini menjadi penurunan saham terbesar yang pernah terjadi dalam sejarah pasar saham US. Tragedi saham merosot ini yang membuat kekayaan Mark Zuckerberg semakin menipis. Kapitalisasi pasar Meta lenyap US$ 251,3 triliun. Alhasil Zuckerberg berada di urutan ujung ke-10 dari daftar orang terkaya versi Indeks Bloomberg Billionaires, hanya lebih kaya US$1 miliar dari Mukesh Ambani, miliarder asal India. Pemicu merosotnya saham Meta Platform Inc ini diduga karena rencana bank sentral AS, The Fed, menaikkan suku bunga acuan. Saham-saham teknologi dinilai sensitif terhadap perubahan kebijakan moneter.",facebook
7/2/2022,up,Finansial,"Februari 2022, apa masuk zona merah lagi?","Intinya...Pasar mata uang kripto cukup diyakini akan melalui rebound di Februari, tidak seperti koreksi cukup tajam di Januari kemarin. Namun jangan lupa bahwa siklus empat tahunan Bitcoin diperkirakan masih akan terjadi.","Februari 2022 menjadi bulan yang cukup menarik bagi trader atau investor dalam bentuk mata uang kripto. Bagaimana tidak, aset ini perlahan memperkuat dirinya setelah Imlek 2022 pada 1 Februari kemarin. Melalui Kompas, Afid Sugiono yang merupakan seorang trader Tokocrypto menyatakan pada kisaran bulan ini, aset kripto sedang tidak pada bearish yang berkepanjangan, sehingga tidak ada harapan untuk melesat naik secara tajam kembali. ""Prediksi Februari akan jadi bulan yang positif bagi market kripto. Secara historis, sejumlah kripto dengan kapitalisasi besar atau big cap, termasuk Bitcoin dan Ethereum bergerak positif di Februari tahun-tahun sebelumnya. Terlebih setelah perayaan Tahun Baru Imlek, para investor akan mengurangi cash out dan mulai kembali meramaikan market,"" dihimpun kompas melalui keterangan tertulis, Minggu (6/2). Hal ini juga diperkuat dengan catatan nilai tukar mata uang kripto pada tanggal 4 kemarin. Berdasarkan Coin Market Cap dan dihimpun kembali oleh kompas, mata uang kripto seperti Bitcoin (BTC), Tether (USDT), Binance Exchange (BNB), Cardano (ADA), Terra (LUNA) dan Polkadot (DOT) menguat. Sementara itu, Ethereum (ETH), Solana (SOL), dan Dogecoin (DOGE) melemah. Pagi itu, harga BTC naik 0,62 persen atau 37.167 dollar AS atau Rp 534,38 juta (kurs Rp 14.378 per dollar AS), dan USTD menguat 0,02 persen senilai 1 dollar AS atau Rp 14.387. BNB juga naik 0,6 persen di lever 371 dollar AS atau Rp 5,3 juta, LUNA melesat 6,5 persen di level 51,2 dollar AS atau Rp 736.153, dan DOT bertambah 0,63 persen di level 18,8 dollar AS atau Rp 270.306. Pada Januari 2022, Bitcoin terus masuk zona merah. Penurunan harga sepanjang awal tahun tersebut menempatkan BTC pada laju terburuknya sejak 2018 lalu. Hal ini menimbulkan spekulasi akan terulang kembali siklus empat tahunan Bitcoin. Jika mengikuti siklus tersebut setelah harga Bitcoin mengalami kenaikan yang luar biasa, para investor akan melakukan koreksi, sehingga mereka melepas keping-keping BTC-nya secara perlahan dalam aksi ambil untung dan mengakibatkan penurunan harga aset kripto. Sebenarnya walaupun sedang di zona merah dan ada tendensi pasar untuk melakukan koreksi, kejadian lain di seputaran Januari 2022 kemarin menjadi batu loncatan untuk aset ini perlahan kembali bergerak di Februari 2022. Penerapan pajak tinggi pemerintah India terhadap aset kripto, Microstrategy yang membeli 660 BTC, kemudian, Presiden Rusia Vladimir Putin yang mendukung aktivitas aset kripto dan Arizona yang akan menjadikan BTC sebagai legal tender. Memang tidak semua kejadian tersebut menimbulkan sentimen pasar yang tinggi, namun karenanya pergerakan pasar mulai kembali terasa. Jadi, siap kembali ke pasar kripto? Sepertinya awal Februari 2022 ini menjadi saat yang baik! Disclaimer on, saran kami untuk perlahan saja kembali ke pasar kripto, serta perlahan juga menyusun ulang di mata uang yang sudah lama beredar dan nilai tinggi dan market cap yang kuat seperti BTC, ETH, BNB,. Atau bila ingin menyimpan buying power, bisa mencoba ke DOGE, atau SOL. Untuk stablecoin terkesan belum banyak pergerakan, tapi tentunya boleh juga dicoba… karena bisa jadi alternatif kalau memang benar siklus 4 tahunan BTC terjadi. Selain itu ada indikasi bahwa mata uang kripto yang dapat dipertukarkan dengan NFT lebih kuat bertahan karena ada kebutuhan yang nyata, yaitu bertukar lukisan atau video ;) Selamat hari senin!",bitcoin
9/2/2022,up,Finansial,Siasat Pemulihan Ekonomi Daerah,Intinya… Kementerian Keuangan RI keluarkan UU Hubungan Keuangan antara Pemerintah Pusat dan Pemerintah Daerah hal ini dipercaya mampu membantu akselerasi perekonomian daerah.,"Direktur Jenderal Perimbangan Keuangan (Dirjen PK) Kementerian Keuanga Astera Primanto Bhakti menyebut undang-undang Hubungan Keuangan antara Pemerintah Pusat dan Pemerintah Daerah dapat membantu akselerasi perekonomian daerah. “Untuk mengakselerasi perekonomian daerah, kita telah meiliki satu undang-undang yang namanya Hubungan Keuangan antara Pemerintah Pusat dan Pemerintah Daerah di mana di dalamnya ada agenda reformasi, yang tentunya di sini tujuannya adalah untuk bisa melakukan pemulihan dan keberlanjutan ekonomi nasional,” Astera Menjelaskan daerah memiliki peran strategis dalam mendukung reformasi perekonomian nasional dengan menjaga momentum pemulihan jangka pendek dan menengah. Hal ini dapat dilakukan dengan memperkuat sistem kesehatan dalam menghadapi potensi living with endemic, mendorong pemulihan daya beli masyarakat, khususnya yang memiliki pendapatan rendah, serta mengeliminasi scarring effect. Di sisi lain, dilakukan juga reformasi struktural melalui pembangunan infrastruktur, termasuk konektivitas dan tekonologi informasi, peningkatan kualitas suber daya manusia (SDM), serta pembukaan lapangan kerja yang berkualitas. Di samping reformasi struktural, pemerintah juga melakukan reformasi fisikal, mulai dari penganggaran, mengarah kepada zero based budgeting, reformasi belanja spending better, reformasi perpajakan, dan pembiyaan yang inovatif.",
10/2/2022,down,Finansial,Omicron Sudah Mulai Berdampak Pada Bisnis Perhotelan,Intinya… Omicron yang baru-baru ini melonjak sudah membuat bisnis perhotelan ketar-ketir. Pegawai yang asalnya sudah mulai masuk seperti biasa kini mulai dapat potongan jam kerja. Tamu hotel pun banyak yang membatalkan pemesanan kamar.,"“Sekitar 10%-20% masyarakat yang sudah melakukan pemesanan kamar hotel terpaksa membatalkan pesanannya dikarenakan merebaknya kembali varian terbaru dari Covid-19 yaitu Omicron” begitu yang dituturkan oleh Direktur Utama PT Hotel Indonesia Natour Iswandi Said. Menurutnya, pengunjung yang melakukan pembatalan mayoritas melakukan penjadwalan ulang tanggal pemesanan. Pengunjung hotel juga cenderung untuk menentukan pemesanan pada menit-menit akhir. Dengan kata lain, pemesanan hotel yang dilakukan jauh-jauh hari sampai saat ini belum ada yang melakukan pembatalan pemesanan. Ketua Umum Perhimpunan Hotel dan Restoran Indonesia (PHRI) Hariyadi Sukamdani juga menegaskan bahwa Omicron telah memberi tekanan lanjutan pada situasi pemulihan sektor usaha perhotelan. Ia mencontohkan situasi di DKI Jakarta yang tingkat okupansi hotel nya sempat di level 50%-55% kini kembali turun ke angka 40%. Untuk video selengkapnya bisa ditonton di sini. Sejalan dengan perkembangan varian Omicron tersebut, pegawai hotel di Puncak Bogor juga kena imbas dan kembali kerja separuh waktu. Menurut Wakil Ketua BPC PHRI Kabupaten Bogor Boboy Ruswandi jam kerja pegawai sudah mulai dikurangi. “Sekarang 10 hari kerja 10 hari libur” ujar Ruswandi. Boboy juga menuturkan bahwa langkah perusahaan hotel mengurangi waktu kerja ini demi menyelamatkan keuangan hotel. Hunian hotel yang dalam beberapa pekan terakhir mengalami penurunan hingga 70 persen tentu berpengaruh terhadap pengaturan biaya operasional hotel mulai dari listrik, internet, dan gaji pegawai. “Kalau dalam satu bulan kerjanya 15 hari berarti upah yang diterima sesuai 15 hari kerja dalam sebulan” ujar Ruswandi.",
11/2/2022,down,Finansial,"Ikut tren NFT, Anang Hermansyah kena masalah dengan Kementerian Perdagangan?","Intinya...Anang masuk ke dunia NFT dan digital dengan meluncurkan token kripto ASIX sebagai langkah awal. Responnya baik dan heboh di jagat maya. Namun, Bappebti bilang kalau ASIX sebenarnya tidak boleh diperdagangkan.","Belakangan ini dunia semakin ramai memperbincangkan NFT (Non-Fungible Token) atau token yang tidak dapat dipertukarkan. NFT adalah aset digital yang diperjualbelikan secara online dengan mata uang tertentu, dalam hal ini biasanya menggunakan aset kripto. Indonesia tidak mau kalah. Belum lama, linimasa dihebohkan dengan kehadiran Ghozali Everyday dengan NFT konsep selfie miliknya, yang berhasil membawa dirinya ke tangga kekayaan. Tidak mau ketinggalan dengan tren yang sedang marak di dunia dan ramai diperbincangkan di linimasa Indonesia, maka beberapa artis pun turut memeriahkan produk ini. Tak terkecuali dengan Anang Hermansyah. Penyanyi, produser, dan juga pebisnis ini dengan peka melihat peluang dan inovasi bisnis di dunia NFT. Untuk saat ini, Anang meluncurkan token kripto sebagai alat pembayarannya dengan nama ASIX. Namun, perjalanannya tidak semulus itu. Sebenarnya, ASIX mendapatkan respons yang cukup baik dari para investor aset kriptor sejak kali pertama diperjualbelikan ke publik pada 27 Januari 2022. Namun, Anang sepertinya harus menerima sedikit masalah dari Kementerian Perdagangan. Token ASIX tidak boleh diperdagangkan oken ASIX tidak diizinkan untuk diperjualbelikan oleh Kementerian Perdagangan melalui Badan Pengawas Perdagangan Berjangka Komoditi (Bappebti). “... Dapat kami sampaikan bahwa Token ASIX dilarang untuk diperdagangkan,” ungkap Bappebti melalui akun Twitter resminya (10/2/2022). Mengapa token kripto milik Anang tersebut dilarang untuk dijual? Ternyata, diketahui bahwa token kripto ASIX belum masuk ke dalam 299 aset kripto yang boleh diperdagangkan di Indonesia. Merujuk pada peraturan Bappebti no 7 tahun 2020, Anang perlu mendaftar dan masuk ke dalam list aset kripto yang boleh diperdagangkan di pasar fisik aset kripto. Dan perlu adanya penilaian dan persetujuan dari Bappebti. “... Kripto baru yang mau diperdagangkan harus masuk dalam daftar di peraturan tersebut setelah dilakukan penilaian oleh Bappebti bersama para pedagang kripto sesuai kriteria penilaian dan batas nilai dalam peraturan tersebut,” ujar Tirta selaku Kepala Biro Pembinaan dan Pengembangan Pasar Bappebti. Anang respons “teguran” Bappebti “... Saya tidak dagang di Indonesia.” Token kripto yang lagi hits dan ramai diperbincangkan ini secara tidak langsung “ditegur” oleh Bappebti. Ingin melindungi bisnisnya, Anang merespons pernyataan Bappebti terkait token ASIX yang tidak boleh diperjualbelikan ke publik. Ia mengungkapkan bahwa ASIX memang tidak dijual di Indonesia, sebab sejauh ini masih diperdagangkan di Binance dan Coingecko. ASIX siap melantai di Indodax eski sudah ramai diperbincangkan, ASIX sebenarnya belum diperbolehkan untuk dijual di Indonesia. Anang pun paham mengenai itu. Sebab, token ASIX sedang dalam pengurusan untuk melantai di exchanger kripto terbesar di Indonesia, Indodax. “Besok kita akan melakukan finalisasi pertemuan, karena sudah 3 kali pertemuan. … Mudah-mudahan besok ada finalisasi, Indodax sudah tidak ada problem dengan kita,” ucap Anang. Bila ASIX sudah berhasil menyelesaikan urusan dengan Indodax, Anang berharap token kripto miliknya bisa mendapat surat persetujuan dari Bappebti dan siap melantai di exchanger kripto terbesar di Indonesia tersebut. Seberapa lakunya token ASIX? Harga token ASIX sempat naik 25 kali lipat sejak dibuka ke publik pada pekan akhir Januari lalu. “Per tadi malam itu sempat naik 25 kali lipat dari launching,” ungkap Basyar selaku developer token ASIX, Minggu (6/2/2022). Bahkan, saat penjualan private, ASIX habis dibeli dalam waktu kurang dari 1 menit. Diborong rekan artis dan musisi Kepopuleran token kripto milik Anang ini pastinya tidak lepas dari partisipasi rekan artis dan musisi. Diketahui Kevin Aprilio membeli token ASIX sebesar Rp100 juta. Adik Atta Halilintar, Thariq mengaku turut membeli token ASIX sekitar 200 juta. Judika juga diketahui membeli 1 miliar token. Diketahui, bersamaan dengan token ASIX ini, Anang akan meluncurkan 3 proyek, di antaranya, game P2E atau pay to earn seperti game congklak, marketplace NFT, dan Nusantaraverse pada kuartal-III 2022.",asix
12/2/2022,down,Finansial,"OJK: lembaga keuangan, jangan dibantuin ya perdagangan aset crypto…",Intinya… OJK melarang lembaga keuangan untuk memfasilitasi kegiatan cryptocurrency serta himbauan dari OJK mengenai skema ponzi aset crypto yang harus diwaspadai.,"Lembaga jasa keuangan di Indonesia dilarang OJK untuk memfasilitasi segala aktivitas perdagangan cryptocurrency. Perbankan, asuransi, hingga multifinance dilarang untuk memasarkan dan atau memfasilitasi perdagangan aset crypto. ""OJK tegas larang lembaga jasa keuangan fasilitasi kripto. OJK dengan tegas telah melarang lembaga jasa keuangan untuk menggunakan, memasarkan, dan atau memfasilitasi perdagangan aset kripto,"" jelas Ketua Dewan Komisioner OJK, Wimboh Santoso, dalam unggahan Instagram OJK. Skema ponzi aset crypto harus lebih diwaspadai oleh masyarakat. Sesuai dengan himbauan OJK, resiko yang akan muncul dari hal tersebut juga harus dipahami karena aset crypto merupakan komoditi yang nilainya sangat fluktuatif. Tingkat literasi keuangan masyarakat Indonesia yang berkisar 38% tergolong masih rendah mempengaruhi kebijakan OJK. Deputi Komisioner Hubungan Masyarakat dan Logistik OJK Anto Prabowo menegaskan langkah OJK mengenai vulnerability aset crypto sudah sesuai dengan perhatian Internasional. ""Berkaitan dengan kegiatan usaha perbankan sudah jelas diatur dalam UU Perbankan yang boleh dan yang dilarang. Bank juga harus memahami (know your customer) agar tidak digunakan sebagai sarana kegiatan yang melanggar hukum seperti antara lain penipuan, kasus ponzi, pencucian uang. ""Beberapa pengawas sektor keuangan negara lain juga mengeluarkan respon terhadap cryptocurrency, diantaranya Singapore (Monetary Authority of Singapore), Uni Eropa (European Central Bank), India (Central Bank of India), Inggris (Bank of England), Rusia (The Russian Central Bank), Turki (Turkey Central Bank) dan China (People Bank of China).",crypto ?
13/02/2022,down,Finansial,Apa itu JHT dan JKN? Kenapa Diperdebatkan?,"Intinya… Baru-baru ini sedang trending di kalangan pekerja dan buruh soal kebijakan baru mengenai jaminan hari tua alias JHT yang biasa dimanfaatkan sebagai pesangon saat PHK, namun sekarang hanya bisa dicairkan saat usia pensiun 56 tahun. Program pengganti JHT ini adalah JKP (Jaminan Kehilangan Pekerja) yang bisa dicairkan sebelum pensiun dengan syarat dan ketentuan berlaku.","Jadi JHT atau jaminan hari tua adalah jaminan dana yang diberikan kepada pekerja yang sudah memasuki masa pensiun. Namun, sebelumnya pekerja atau buruh yang terancam kehilangan pekerjaan (PHK) bisa mencairkan dana tersebut sebagai pesangon. Kebijakan baru pemerintah mengatur pencairan dana jaminan hari tua (JHT) ketika pekerja memasuki usia pensiun 56 tahun atau meninggal dunia, atau cacat tetap. Hal tersebut yang memicu pro dan kontra terutama di kalangan pekerja dan buruh. Kebijakan pemerintah melalui BPJS Ketenagakerjaan menawarkan program baru, yakni Jaminan Kehilangan Pekerjaan (JKP). JKP adalah program ke-5 dari BPJS Ketenagakerjaan, setelah JHT, Jaminan Kematian, Jaminan Kecelakaan Kerja (JKK) dan Jaminan Pensiun. Yang membuat berbeda dengan empat program pendahulunya, JKP dikhususkan untuk peserta yang kehilangan pekerja maupun yang terkena pemutusan hubungan kerja (PHK). Untuk mendapatkan manfaat dari program ini, peserta perlu memenuhi persyaratan yang diberikan oleh BPJS Ketenagakerjaan. Dilansir dari laman resmi BPJSTK, berikut syarat-syarat yang perlu dipenuhi peserta: WNI Belum mencapai usia 54 tahun saat terdaftar menjadi peserta Pekerja pada Pemberi Kerja (PK) Badan Usaha (BU) Skala Usaha Menengah dan Besar yang sudah mengikuti 4 Program (JKK, JKM, JHT, dan JP) Pekerja pada PK atau BU Skala Kecil dan Mikro dengan minimal ikut 3 program (JKK, JKM dan JHT) Terdaftar sebagai Pekerja Penerima Upah pada Badan Usaha Program JKN BPJS Kesehatan",
14/02/2022,up,Finansial,Selamat hari Senin! siap kembali berinvestasi?,"Intinya… Untuk pekan ini memang kita perlu berhati-hati karena pekan lalu IHSG ditutup melemah tipis, namun bukan berarti kita mesti pesimis!","Memang Indeks Harga Saham Gabungan (IHSG) ditutup melemah 0,12% di level 6.815,61 pada perdagangan hari Jumat (11/02) kemarin. Pada pekan lalu, indeks juga bergerak konstan, dengan nilai transaksi 11.4 Triliun Rupiah. Walaupun terjadi pelemahan, pihak asing tetap cukup tertarik ke pasar lokal. Terbukti dengan net buy yang cukup tinggi dengan net buy sebesar 783 Miliar Rupiah. TLKM dan BMRI paling banyak diminati, sementara ANTM dan UNVR paling banyak dilepas asing. Hasil rangkuman ini dan gambar diatas dirangkum oleh CNBC Finance. Aliran asing yang cukup deras ini mencetak rekor tertinggi sepanjang sejarah IHSG bahkan sebanyak 3 kali. Aliran modal asing yang besar masuk ke dalam negeri menjadi salah satu faktor yang mendongkrak kinerja IHSG, selain juga data-data ekonomi dari dalam negeri. Sepanjang pekan ini, investor asing tercatat melakukan beli bersih (net buy) tercatat sebesar 7,05 triliun di pasar reguler, dan jika ditambah pasar tunai dan nego totalnya menjadi lebih dari Rp 7,6 triliun. Nilai transaksi tercatat lebih dari Rp 68 triliun. IHSG bahkan masih mampu menguat meski bank sentral Amerika Serikat (The Fed) diperkirakan akan menaikkan suku bunga 50 basis poin bulan depan pasca rilis data inflasi yang melesat 7,5% year-on-year (yoy). Minggu lalu, BI juga melaporkan tingkat keyakinan konsumen yang semakin optimistis di awal tahun ini. Ketika konsumen semakin optimistis, maka belanja akan semakin meningkat dan pada akhirnya memacu pertumbuhan ekonomi. Jadi, sudah cukup optimis untuk minggu ini? Bagus! Namun mari kita melihat fakta bahwa kenaikan positif ini juga banyak berasal dari sentimen asing. Selamat menyesuaikan portofolio dan semoga cuan!",ihsg ?
16/02/2022,down,Finansial,"Ancaman perang, ekonomi Indonesia masih aman?",Intinya… Ancaman perang Rusia-Ukraina masih menjadi perhatian investor global karena dikhawatirkan akan menekan nilai tukar.,"Menteri Keuangan Republik Indonesia Sri Mulyani turut menyoroti kondisi geopolitik yang memanas belakangan ini antara Rusia dan Ukraina. Bendahara negara tersebut mengkhawatirkan konflik kawasan itu dapat memicu perang dunia ke III karena menyeret Amerika Serikat (AS) dan Eropa. Jika Kondisi ini terus terjadi, maka bisa mempengaruhi harga komoditas khususnya energi. Indonesia sebagai pengimpor bahan bakar minyak akan terkena imbas cukup berat dari sisi Anggaran Pendapatan Belanja Negara (APBN). Ancaman perang Rusia-Ukraina tak hanya akan berimbas kepada sektor komoditas. Namun, hal ini juga ditakutkan oleh para investor yang mengkhawatirkan akan menekan nilai tukar hingga peningkatan netflow asing yang akan berimbas pada tekanan di pasar keuangan. Seperti analisis terhadap daya tahan pasar keuangan di tengah tekanan sentimen perang dunia, omicron hingga kebijakan moneter The Fed.",bahan bakar minyak
17/02/2022,down,Finansial,Skenario finansial jika perang dunia ketiga benar-benar terjadi,"Intinya… Pasca penarikan pasukan Rusia dari Ukraina, harga minyak langsung anjlok 3,6 persen menjadi 92,07 per barrel. Ini tentu kabar yang buruk bagi dunia bisnis mengingat tren positif beberapa bulan kebelakang. Di satu sisi ini juga kabar yang baik mengingat harga minyak bisa melambung tinggi jika perang terjadi.","Bagi anda yang sudah familiar dengan video game bergenre perang modern atau mendekati masa depan seperti serial Battlefield atau Call of Duty pasti sudah hafal dengan alur cerita single player nya yang selalu nampak heroik. Anda sebagai tokoh utama yang membela kebenaran dan berusaha menumpas musuh-musuh jahat (yang sebagian besar selalu menempatkan pihak Amerika sebagai pahlawan). Dalam misi-misi awal game selalu terlihat adanya pertikaian pihak-pihak atas dan politisi yang berbuah perang. Pertikaian itulah yang baru saja terjadi antara Rusia dan Ukraina. Perang mungkin bisa saja terjadi jika Pak Putin tidak menarik pasukannya dan meningkat ke eskalasi internasional. Apakah sebenarnya ada ‘tokoh utama’ yang sudah jadi pahlawan seperti di video game ‘rutin’ yang anda mainkan sepulang sekolah dahulu? Semoga saja dia sudah diberi medali ya. Cukup intermezzo cerita nya. Dalam segi finansial sendiri secara historis perang memang bisa menghancurkan semua sendi kehidupan suatu negara. Mari kita mulai bicara tentang perang dunia kesatu. Beberapa hal penting yang terjadi di dunia ekonomi selama masa 1914-1918 antara lain: Kepanikan finansial di jual beli saham Penurunan harga saham. Pendanaan yang fokus pada mesin-mesin perang. Inflasi yang meroket. Lalu bagaimana dengan krisis-krisis lain seperti perang dunia kedua atau kejadian 9/11? Kurang lebih poin nomor satu dan dua selalu terjadi jika adanya ketidakstabilan kondisi dunia. Perang tidak melulu berdampak negatif. Dalam sejarahnya perang dunia kedua membantu Amerika Serikat meningkatkan lapangan pekerjaan dan mem­-boost ekonomi mereka pasca Great Depression. Tentu ini juga terjadi karena perang dunia kedua tidak terjadi di tanah Amerika, mereka pergi dan membantu sekutu untuk memenangkan perang. Masuk ke masa kini ketika konflik Rusia dan Ukraina semakin menuju eskalasi global. Rusia yang merupakan salah satu negara eksportir minyak tentu bisa membuat dunia ketar-ketir. Pasalnya harga minyak akan meroket naik jika perang terjadi (yang sebagian besar akan difokuskan untuk pendanaan mesin perang dan embargo kepada negara-negara musuh Rusia). Kondisi ini tentu akan berdampak global dan bisa membahayakan sektor-sektor industri kita, apalagi jika berbicara soal harga kebutuhan pokok. Mungkin yang masih ingat waktu dahulu zaman Pak SBY menaikkan harga BBM Premium dan semua harga-harga perlahan naik paham akan situasi ini. Terlepas dari cerita tersebut, beberapa aset penting yang bisa diamankan jika perang terjadi atau ada ketidakstabilan harga antara lain: Emas dan perak (safe heaven asset). Emas sendiri merupakan aset yang stabil dan dilirik investor jika ada ketidakstabilan pasar. Tidak selamanya saham juga menjadi opsi yang buruk, saham batu bara bisa menjadi solusi khususnya jika sahamnya fokus di pasar ekspor. Namun ini pun masih di ambang batas asumsi. Logika lain yang muncul jika komoditas perak naik, maka harga sahamnya pun akan naik. Mesin-mesin perang yang butuh tingkat manufaktur yang tinggi juga membutuhkan batu bara sebagai bahan bakarnya. Analisis pakar keuangan secara lengkap dapat dilihat di sini. Namun semua skenario ini tidak akan terjadi jika perang nuklir yang berkecamuk, malah bisa-bisa kita hidup seperti di Metro 2033 hahaha.",minyak
