date,label,category,title,mksa,content,harga yang dicari
24/03/2022,down,Finansial,"Fahrenheit, Skema Ponzi & Ekonomi Perilaku","Intinya… Baru baru ini jagat dunia trading digemparkan oleh kasus penipuan Fahrenheit. Modus robot yang bisa memantau naik turunya pasar ini berhasil membuat kerugian hingga 5 triliun Rupiah. Lagi-lagi skema member dan Ponzi menjadi alat utama, ditambah pemanfaatan teori loss aversion.","Kasus penipuan trading masih berlanjut. Belum selesai masalah kemarin soal Quotex dan Binomo, kini muncul lagi modus operandi terbaru yaitu robot trading Fahrenheit. Beberapa korban sudah melapor ke pihak yang berwajib dan total kerugian ditaksir mencapai 5 triliun. Dikutip dari CNBC, para korban mengaku trading pada awal mulanya berjalan lancar namun semenjak tanggal 28 Januari layanan diberhentikan dengan alasan mengurus perizinan. Pihak Fahrenheit menjanjikan trading akan bisa berjalan pada tanggal 25 Februari, tentu juga klien bisa melakukan withdraw. “Pada akhirnya tidak terjadi, diundur sampai 7 Maret, malamnya tiba-tiba trading lagi dan minusnya luar biasa. Yang terus-menerus tanpa stop sampai uang terkuras,"" kata salah seorang korban Chris Ryan. Dalam kesempatan wawancara Kompas TV pada video youtube berikut ini dengan salah seorang korban bernama Samuel Abraham ia juga menuturkan bahwa dia sendiri mengaku kenal dengan Direktur Fahrenheit yang saat ini sudah ditetapkan sebagai tersangka bernama HS. Lagi-lagi skema ‘member’ di dalam grup menjadi salah satu penarik massa terbanyak dalam kasus ini dengan koordinator dari pihak Fahrenheit berfungsi sebagai pemantau pergerakan trading. “Dari yang $ 1000 itu saya sudah mau sampai BEP (balik modal) sekitar 13 juta lalu makanya saya top up lagi di $ 3000” ujarnya. Skema Ponzi masa kini. Masih ingat dengan kasus First Travel beberapa tahun kebelakang? Ya kurang lebih yang terjadi kepada korban Fahrenheit sama dengan kasus tersebut. Jemaah yang diberangkatkan menggunakan uang jemaah yang baru mendaftar, keuntungan trading yang datang dari member baru yang muncul. Para korban dapat keuntungan ‘palsu’ yang dibuat oleh skema ini. Perbedaan kentara yang sekarang terjadi terdapat pada keluarnya margin call atau bisa dibilang benar-benar ‘dirampok’ disaat memang sudah ketahuan pemerintah. Dalam kutipan wawancara tersebut, pihak Fahrenheit juga memanfaatkan teori ekonomi perilaku dalam melakukan tindak kejahatan nya. Kutipan dalam buku Misbehaving karya Richard H. Thaler menguatkan asumsi ini. “Fakta bahwa rasa sakit akibat kerugian lebih kuat daripada rasa senang akibat keuntungan yang setara disebut rasa tak suka rugi (loss aversion). Gagasan tak suka rugi telah menjadi alat terkuat ahli ekonomi perilaku”. Perhatikan juga kutipan wawancara lanjutan dengan Samuel Abraham yang semakin menjurus ke arah kontrol perilaku: “Ada yang sudah pernah tarik modalnya semuanya lalu tiba-tiba merasa tertarik lagi untuk bergabung, mereka baru masukin duitnya tiba-tiba beberapa hari kemudian trading freeze” ujar Samuel. See? Semudah itukan mengarahkan perilaku seseorang jika tahu caranya? Apalagi orang yang serakah dan hanya ingin duit mudah tanpa tahu resiko. Boro-boro memikirkan soal logika investasinya. IIngat kata Bang Napi, waspadalah, waspadalah!",fahrenheit
25/03/2022,up,Finansial,Hati-Hati! Pengguna Mobile Banking Harus Perhatikan Ini Bila SIM Card Mati,"Intinya… Kalau ingin ganti nomor baru atau SIM Card, Anda perlu menghapus data-data penting terlebih dahulu. Terutama data perbankan dari mobile banking Anda.","Kebanyakan orang sudah mengaktivasi layanan bank mereka di hp. Dan hal ini akrab disebut sebagai layanan mobile banking. Salah satu syarat utama kita ingin mengaktifkan mobile banking adalah, kita memiliki SIM Card aktif. Sebab, biasanya, saat aktivasi, kode OTP akan dikirimkan melalui SMS ke nomor aktif yang kita daftarkan. Itulah seberapa pentingnya nomor atau SIM Card kita untuk berjalannya layanan mobile banking. Karena SIM Card menjadi aspek yang penting, maka bahaya bisa menghampiri dengan mudah. Ada bahaya yang bisa menimpa kita bila lalai memperhatikan masa aktif SIM Card kita yang terkoneksi atau terdaftar pada mobile banking. Hal ini berkaitan dengan SIM Card yang sudah tidak aktif atau dalam kata lain, kita mengganti SIM Card baru. Bila kita mengganti SIM Card baru, maka perlu melaporkan ke bank bahwa SIM Card yang lama sudah tidak aktif. Selain itu, Anda sebaiknya menghapus data-data penting terkhusus yang berkaitan dengan transaksi mobile banking dari SIM Card lama Anda sebelum menggantinya ke yang baru. Tujuan dilakukan ini agar mobile banking tidak mudah jebol dan tidak ada celah penggunaan OTP yang dikirimkan ke nomor lama Anda. “Kalau mau ganti nomor HP ke nomor baru, pastikan nomor lama itu dihapus data-data di perbankannya. Jangan sampai tidak,” kata Jahja Setiaatmadja, Presiden Direktur PT Bank Central Asia Tbk (BCA) seperti dikutip dari detikcom, (24/02/2022). Ini sebenarnya menjadi cara mudah dan sederhana. Anda hanya perlu menghapus data-data di SIM Card lama sebelum menggantinya dan melaporkannya ke pihak bank. Namun, langkah sederhana ini masih sering dilupakan oleh nasabah. Jika ini dilupakan, maka nasabah bisa menjadi sasaran pelaku kejahatan. “Karena ada celah di titik tertentu. Gampangnya, nasabah ganti SIM Card di operator, nasabah nggak aware dan ada celah di perbankan,” jelas Ruby Alamsyah selaku Digital Forensic Analyst. Ruby menambahkan bahwa pelaku bisa mendapatkan SIM Card korban dari mana pun itu. Dan bila belum dinonaktifkan, pelaku dapat login dan transaksi sebagai nasabah di mobile banking tersebut. Sebab, OTP akan dikirmkan melalui SMS. Maka dari itu, pastikan untuk mengapus data-data perbankan dan data penting milik Anda dari SIM Card lama bila ingin mengganti ke yang baru. Jangan lupa juga untuk melaporkannya ke pihak bank bahwa Anda telah mengganti nomor atau SIM Card baru.",
26/03/2022,up,Finansial,UNUD Menjadi yang Pertama di Luar Jawa Ekspansi Program Campus Financial Ecosystem milik BNI,"Intinya… BNI menggandeng UNUD untuk melakukan program Campus Financial Ecosystem. Penandatanganan Nota Kesepahaman (MoU) oleh Rektor Universitas Udayana I Nyoman Gde Antara dan Direktur Hubungan Kelembagaan BNI Sis Apik Wijayanto dilakukan pada hari Jumat, 25 Maret 2022.","Sebagai wujud nyata konsistensi BNI sebagai Bank yang sangat dekat dengan kampus melalui program Campus Financial Ecosystem, PT Bank Negara Indonesia (Persero) Tbk kembali melakukan ekspansi dengan menggandeng Universitas Udayana. Program ini menjadi solusi transaksional dan non transaksional lengkap dan terbaik untuk memenuhi kebutuhan Civitas Akademika. Penandatangan Nota Kesepahaman (MoU) tentang Ekosistem Keuangan Perguruan Tinggi menjadi permulaan untuk program Campus Financial Ecosystem. Penandatangan dilakukan pada hari Jumat, 25 Maret 2022 oleh Rektor Universitas Udayana I Nyoman Gde Antara dan Direktur Hubungan Kelembagaan BNI Sis Apik Wijayanto di Gedung Rektorat Universitas Udayana. Selain melakukan penandatanganan MoU, BNI dan UNUD melakukan: Integrasi sistem keuangan melalui Cash Management System Program pemberian fasilitas kredit tanpa agunan bagi pegawai dan dosen yang disebut sebagai BNI Fleksi Pembiayaan kredit BNI Fleksi Pendidikan bagi mahasiswa S2 dan S3 Penerbitan Kartu Kredit Affinity Program Magang bagi mahasiswa S1 Program dukungan bagi UMKM binaan Universitas Udayana melalui BNI Edupreneur BNI berharap dengan program ini dapat membantu mewujudkan UNUD menuju Cashless Society yang terintegrasi dengan layanan yang dikembangkan BNI. Sebelumnya BNI juga bekerja sama dengan Universitas Udayana seperti beberapa layanan terbukti telah memudahkan transaksi. Layanan tersebut meliputi Student Payment Center (SPC) Host to Host, pembayaran tunjangan kinerja, pengelolaan keuangan, penempatan Outlet BNI di lingkungan kampus UNUD.",bni
28/03/2022,up,Finansial,Beli Minyak pake Bitcoin?,Intinya… Rusia sedang berpikir untuk melakukan ekspor migas dengan pembayaran lewat Bitcoin.,"Invasi yang dilakukan Rusia terhadap Ukraina memang berdampak besar terhadap dunia. Salah satu yang terdampak adalah keadaan ekonomi Rusia, terutama dalam bidang ekspor. Saat ini, Rusia sedang mempertimbangkan untuk menjual minyak dan gas (migas) ke negara lain dengan menggunakan bitcoin. Sanski yang diperhadapkan oleh pihak Barat membuat Rusia untuk mempertimbangkan opsi menjual barang - barang migas dengan aset kripto. Dalam konferensi pers yang direkam dalam video, Ketua Komite Energi Duma Rusia Pavel Zavalny mengatakan untuk melakukan kegiatan jual-beli dengan opsi yang lebih fleksibel terhadap negara - negara yang “bersahabat” seperti Turki dan China. Namun, terhadap negara - negara yang “tidak ramah” menggunakan rubel Rusia. ""Kami telah lama mengusulkan ke China untuk beralih ke penyelesaian dalam mata uang nasional untuk rubel dan yuan... Dengan Turki, itu akan memakai lira dan rubel,"" kata Zavalny disadur detikcom dari CNBC, Minggu (27/3/2022). Meskipun Amerika Serikat telah melarang impor minyak terhadap Rusia, namun hal ini tidak mungkin diikuti oleh negara - negara dalam Uni Eropa, karena kebergantukan ekonomi mereka terhadap Rusia. ""Rusia jelas ingin melakukan diversifikasi ke mata uang lain,"" kata Nic Carter, salah satu pendiri Coin Metrics. Carter juga pula mengatakan bahwa Rusia telah mempersiapkan transisi untuk menjauhkan diri dari dolar sejak 2014, ketika mulai melepaskan semau Treasurys AS. Satu hal yang perlu digaris bawahi adalah perubahan ini begitu penting dikarenakan Rusia merupakan supplier minyak dan gas terbesar di dunia.",bitcoin
31/03/2022,up,Finansial,Waspadai kenaikan harga pangan dan inflasi,"Intinya… Akhir-akhir ini harga jajanan warung-warung dekat kampus di Bandung sudah merangkak naik terutama di kisaran dua ribu hingga lima ribu rupiah. Ini sejalan dengan kenaikan harga komoditas yang terjadi menjelang bulan Ramadhan yang berkisar di angka yang serupa walau stok nya sendiri masih aman. Ini memicu inflasi, terutama di tengah konflik Rusia-Ukraina.","Waspadai kenaikan harga bahan panganan sebelum ramadhan tiba. Beberapa bahan pokok seperti bawang putih, ayam, gula pasir, minyak goreng, daging sapi, dan telur mengalami kenaikan walau tidak begitu signifikan. Rata-rata komoditas tersebut mengalami kenaikan harga kurang lebih di kisaran seribu hingga lima ribu rupiah. Harga yang naik dipicu oleh siklus musiman yang terjadi selama bulan puasa di mana persediaan untuk sahur, buka puasa dan juga lebaran yang meningkat. Di sisi lain Badan Pangan Nasional (BPN) memastikan bahwa stok semua bahan panganan tersebut aman, terutama selama dua bulan ke depan hingga Mei 2022. Seperti yang dikutip dari pernyataan berikut: ""Berdasarkan prognosa neraca pangan yang kami susun untuk persiapan April-Mei ini cukup. Posisi neraca pangan sampai Mei, di sini neracanya positif,"" ucap Sekretaris Utama BPN, Sarwo Edhy dalam diskusi media secara virtual di Jakarta, Rabu (30/3/2022 dikutip dari Kompas Proyeksi Inflasi Dikutip dari Kontan, Ekonom Bank Mandiri Faisal Rachman memperkirakan, inflasi pada bulan Maret 2022 sebesar 0,71% mom atau secara tahunan sebesar 2,69% year on year (yoy), menguat dari 2,06% yoy pada Februari 2022. Inflasi menjadi yang tertinggi semenjak Maret 2022 atau sejak pandemi ‘resmi’ masuk ke Indonesia. Masalah permintaan pangan yang meningkat mendorong kenaikan harga dan juga pola musiman Ramadhan. Peningkatan juga didorong oleh pencabutan kebijakan harga eceran tertinggi (HET) untuk minyak goreng serta peningkatan bahan bakar rumah tangga (BBRT). Selain hal tersebut, inflasi juga dipicu oleh: Pelonggaran PPKM. Mobilitas masyarakat meningkat sehingga inflasi pada kelompok restoran dan transportasi terjadi. Terjadi juga peningkatan perputaran uang. Peningkatan harga emas (safe heaven instrument) karena konflik Rusia-Ukraina. Suplai komoditas, energi, dan pangan karena konflik Rusia-Ukraina", bahan pokok ?
2/4/2022,up,Finansial,"PPN Naik Jadi 11 Persen, Harga Mie Instan Dan Minyak Goreng Juga Ikut Naik","Intinya… kenaikan tarif PPN menjadi 11 persen dirasakan oleh Staf Ahli Menteri Keuangan (Menkeu), Yustinus Prastowo saat berbelanja mie instan di swalayan ternyata naik sekitar Rp. 25. Kenaikan PPN juga mempengaruhi harga minyak goreng di ritel-ritel.","Pemerintah resmi menaikkan tarif Pajak Pertambahan Nilai (PPN) sebesar 1 persen, naik dari 10 persen menjadi 11 persen mulai pada hari Jumat, 1 April 2022. Kenaikan PPN ini berdampak pada sejumlah komoditas, seperti kenaikan harga mie instan dan minyak goreng. Kenaikan tersebut dirasakan oleh Staf Ahli Menteri Keuangan (Menkeu), Yustinus Prastowo saat berbelanja ke swalayan bahwa harga mie instan yang dibelinya naik tipis, sekitar Rp 25. ""Saya tadi beli mie instan. Ternyata ketika kita cek dalam satu bungkus PPN naik Rp 25, kalau (untuk mie instan) yang dinaikkan. Ini asumsinya naik, saya hitung Rp 25 perak pada 1 April dibanding 31 Maret,"" kata Yustinus dalam media briefing di Pulau Dua Restaurant, Jakarta Pusat, Jumat (1/4/2022). Selain mie instan, minyak goreng juga ikut naik akibat dari pengenaan tarif PPN 11 persen. Kenaikan PPN juga mempengaruhi harga minyak goreng kemasan di ritel-ritel. Sementara minyak goreng yang tersedia di toko-toko kelontong, PPN sudah dipungut saat berbelanja di distributor. ""Kalau minyak kemasan memang sudah dari dulu kena (PPN) jadi ya ada penyesuaian harga,"" bebernya. Barang/jasa tetap tidak kena PPN. Selain barang/jasa yang diberikan fasilitas bebas PPN, pemerintah juga menetapkan batang/jasa yang tetap dibebaskan dari PPN seperti. Barang yang merupakan objek pajak daerah: makanan dan minuman yang disajikan di hotel, restoran, rumah makan, warung, dan sejenisnya; Jasa yang merupakan objek pajak daerah: jasa penyediaan tempat parkir, jasa kesenian dan hiburan, jasa perhotelan, dan jasa boga atau catering; Uang, emas batangan untuk kepentingan cadangan devisa negara, dan surat berharga;",bahan pokok ?
2/4/2022,down,Finansial,ARA ARA beruntun saham WOMF…,Intinya… PT Wahana Ottomitra Multiartha Tbk (WOMF) menyentuh ARA dua hari berturut-turut dan menjadi top gainers pada perdagangan Kamis (31/3/22) serta efek dari pengumuman kembalinya keluarga Thohir di WOM Finance.,"PT Wahana Ottomitra Multiartha Tbk. (WOMF) sebuah perusahaan pembiayaan yang memimpin top gainers pada perdagangan kamis (31/3/22). Saham emiten ini melesat 78 poin ke level Rp 390 atau berkisar 25 persen. Kenaikan tersebut membuat saham WOMF auto reject atas (ARA) perdagangan kamis. Sebelumnya yaitu hari Rabu (30/2/22) juga menyentuh ARA ke level Rp312 atau naik 24,80 persen. Kembalinya keluarga Thohir di WOM Finance menjadi sinyal penguatan yang menyebabkan saham WOMF mencuat setelah pengumuman tersebut. WOM Finance setelah belasan tahun akhirnya Wahana Artha Group kembali menjadi pengendali yang sebelumnya WOMF dikendalikan oleh PT Bank Maybank Indonesia Tbk (BNII). Berdasarkan informasi WOM Finance di BEI 29 Maret 2022, pada Februari 2022 Wahana Artha Group melalui PT Wahana Makmur Sejati telah lolos dalam penilaian dan kepatutan dari Otoritas Jasa Keuangan (OJK) dan pada Maret 2022 juga telah mendapatkan restu dari RUPST. Dengan begitu kepemilikan 25,01 persen WOMF oleh Wahana Makmur Sejati menjadikannya sebagai pemegang saham pengendali, mendampingi Bank Maybank dengan ke[emilikan mayoritas 67,49 persen dan masyarakat 7,5 persen. FYI… Wahana Makmur Sejati merupakan dealer resmi sepeda motor Honda sejak 1972. Melalui restu PT Astra Honda Motor (AHM), perusahaan ini membawahi 114 dealer dan 315 bengkel Astra Honda Authorized Service (AHASS). Wahana Artha Group berafiliasi dengan kelaurga besar Thohir yang dimana almarhum Teddy Thohir tercatat sebagai founder dan Garibaldi Thohir menjadi Presiden Komisaris Wahana Artha Group serta tercatat sebagai Komisaris WOM Finance.",PT Wahana Ottomitra Multiartha Tbk. (WOMF)
3/4/2022,down,Finansial,"Banjir Dividen, Bikin Cuan di Bulan April","Intinya… Momen pembagian dividen 2022 yang ditunggu-tunggu oleh sebagian investor saham jatuh pada bulan April dengan banyaknya saham yang akan membagikan dividen pada bulan ini. Beberapa saham diantaranya Adira Dinamika Multi Finance (ADMF), dan Wahana Ottomitra Multiartha (WOMF), Sido Muncul (SIDO), Garuda Food (GOOD), Eastparc Hotel (EAST), Bank Danamon Indonesia (BDMN), dan Fajar Surya Wisesa (FASW)","Pembagian dividen merupakan momen yang ditunggu-tunggu setiap tahun bagi sebagian investor saham. Bulan April 2022 akan ada banjir dividen dari beberapa saham diantaranya Adira Dinamika Multi Finance (ADMF), dan Wahana Ottomitra Multiartha (WOMF). Selain itu juga ada Sido Muncul (SIDO), Garuda Food (GOOD), Eastparc Hotel (EAST), Bank Danamon Indonesia (BDMN), dan Fajar Surya Wisesa (FASW). 1. SIDO Dalam RUPST, para pemegang saham SIDO menyetujui pembagian dividen dari 90 persen dari laba bersih tahun buku 2021 sebesar Rp 1,26 triliun. Laba SIDO sepanjang tahun 2021 tumbuh sekitar 35 persen dibandingkan tahun sebelumnya Rp 934,01 miliar. Adapun 90 persen dari laba bersih tahun 2021, adalah sebesar Rp 1,14 triliun atau setara Rp 38 per saham. Rinciannya, Rp 15,3 per atau senilai Rp 455,48 sudah dibagikan pada Agustus 2021, sisanya Rp 22,7 per saham atau Rp 681 miliar akan dibagikan sesuai jadwal dividen final. 2. ADMF Sepanjang 2021, ADMF menorehkan laba bersih senilai Rp 1,2 triliun, dan akan membagikan dividennya sebesar 50 persen sesuai dengan persetujuan para pemegang saham dalam Rapat Umum Pemegang Saham Tahunan (RUPST) yakni sebesar Rp 607 miliar yang setara dengan Rp 607 per saham. 3. WOMF Rp 33,18 miliar merupakan nilai yang telah disepakati oleh para pemegang saham WOMF dan berencana membagikan dividen tahun buku 2021 sebesar Rp 9,5 per saham. WOMF sepakat untuk membagikan dividen setara dengan 30 persen laba bersih perseroan tahun buku 2021 yakni sebesar Rp 110,61 miliar. 4. BDMN BDMN akan membagikan dividen senilai Rp 56,33 per saham atau senilai Rp 550,59 miliar. Dalam RUPST, para pemegang saham BDMN sepakat untuk membagikan dividen sebesar 35 persen dari laba bersih tahun 2021, sebesar Rp 1,57 triliun. Laba bersih BDMN tahun 2021 naik 56,12 persen dibanding periode sebelumnya Rp 1,01 triliun. 5. EAST EAST akan membagikan dividen senilai Rp 5,48 miliar atau sebesar Rp 1,33 per saham dari laba bersih tahun buku 2021 menurut RUPST Adapun laba bersih yang diatribusikan kepada entitas induk ditetapkan Rp 12,14 miliar, saldo laba ditahan yang tidak dibatasi penggunaanya Rp 5,59 miliar, dan total ekuitas Rp 245,55 miliar. 6. FASW Rp 294,86 miliar merupakan nilai yang telah disepakati oleh para pemegang saham FASW dan berencana akan membagikan dividen tunai senilai Rp 119 per saham. Dalam RUPST, para pemegang saham menyetujui pembagian dividen sebesar 47,95 persen dari laba bersih 2021 senilai Rp 614,92 miliar.","Adira Dinamika Multi Finance (ADMF), dan Wahana Ottomitra Multiartha (WOMF), Sido Muncul (SIDO), Garuda Food (GOOD), Eastparc Hotel (EAST), Bank Danamon Indonesia (BDMN), dan Fajar Surya Wisesa (FASW)"
5/4/2022,down,Finansial,Gubernur Bank Sentral Sri Lanka mengundurkan diri,Intinya… Gubernur Bank Sentral Sri Lanka mengundurkan diri menyusul 26 menteri di kabinet yang telah mengundurkan diri sebelumnya.,"Ajith Nivard Cabraal selaku Gubernur Bank Sentral Sri Lanka mengajukan pengunduran diri dari pemerintahan menyusul seluruh menteri kabinet yang mengundurkan diri yang disampaikan pada Senin 4 April 2022 dikutip dari Reuters. Pada akun twitternya juga secara terpisah ia menyatakan telah mengajukan pengunduran diri langsung ke Presiden Sri Lanka Gotabaya Rajapaksa. Mengutip dari CNN Indonesia ""Dalam konteks pengunduran diri seluruh menteri kabinet, saya hari ini mengajukan pengunduran diri saya sebagai gubernur @CBSL kepada beliau Presiden Gotabaya Rajapaksa. @GotabayaR #SriLanka #GoSL,"" cuitnya. Kata menteri pendidikan Dinesh Gunawardena pada pertemuan larut malam 26 menteri di kabinet menyerahkan surat pengunduran diri. Seluruh kabinet Sri Lanka mengundurkan diri dan hanya Presiden Gotabaya Rajapaksa dan kakak laki-lakinya, Mahinda Rajapaksa selaku Perdana Menteri yang tidak mengundurkan diri. Kericuhan di ibu kota Sri Lanka terjadi karena dipicu oleh krisis ekonomi yang sedang dihadapinya. Sejak merdeka dari Inggris pada 1948, Sri Lanka menghadapi kekurangan makanan, bahan bakar, dan kebutuhan pokok lainnya. Hal ini membuka jalan bagi presiden menunjuk kabinet baru pada senin dan beberapa yang mengundurkan diri akan diangkat kembali. Kekosongan yang terjadi disaat keadaan darurat yang diberlakukan setelah rumah presiden yang berlokasi di ibu kota Kolombo perusahaan diserbu oleh kerumunan, dan pada Senin pagi jam malam nasional akan berakhir",
8/4/2022,down,Finansial,Top up dompet digital kena PPN 11 persen,Intinya… Layanan jasa pembayaran uang elektronik atau dompet digital resmi dikenakan pajak pertambahan nilai (PPN).,"Berlaku mulai 1 Mei 2022 Jasa penyelenggara teknologi finansial seperti jasa pembayaran uang elektronik atau dompet digital resmi dikenakan pajak pertambahan nilai (PPN). Hal ini tertuang pada Peraturan Menteri Keuangan Nomor 69 Tahun 2022 tentang pajak penghasilan dan pajak pertambahan nilai atas penyelenggaraan teknologi finansial. PPN yang akan dikenakan pada dompet digital hanya berlaku untuk biaya jasa top up atau isi ulang saja begitu kata Kasubdit Peraturan PPN, Perdagangan, Jasa dan PTLL DJP Bonarsius Sipayung. Mengutip dari Republika ""Misal, saat Anda mengisi e-money sebesar Rp 1 juta, biaya administrasi yang dikenakan sebesar Rp 1.500. Maka, PPN yang dikenakan adalah 11 persen dari Rp 1.500, bukan Rp 1 juta,"" ujar Bonar saat konferensi pers virtual, Rabu (6/4/2022). Seperti contoh yang diberikan oleh Bonar, jika melakukan transfer uang secara digital dengan biaya administrasi sebesar Rp 6.500. Maka, yang dikenakan PPN 11 persen sebesar Rp 715 per transaksi. ""Jadi bukan nilai top up, tapi jasa yang dipakai tadi yang fasilitasi oleh fasilitator. Jadi atas fee (komisi), bukan top up sejuta kena (PPN) Rp 1 juta, enak benar uang saya hilang dong,"" ujarnya. Adapun penyelenggara fintech yang dikenakan PPN antara lain jasa pembayaran, penyelenggara penyelesaian transaksi (Settlement) investasi, dan penyelenggara penghimpunan modal atau crowdfunding. Kemudian pada pasal 7 (2) layanan uang elektronik berupa pengisian ulang, tarik tunai melalui pihak lain yang bekerja sama dengan penyelenggara dompet elektronik atau menggunakan Channel lain, pembayaran transaksi, pembayaran tagihan, transfer dana dan atau layanan paylater. Menurut Bonar sendiri PMK ini diterbitkan agar menyamanakn perlakuan pemerintah terhadap transaksi keuangan digital dan konvensional yang sebelumnya telah dikenai pajak.",jasa pembayaran uang elektronik atau dompet digital ?
9/4/2022,up,Finansial,IHSG tembus rekor lagi!,"Intinya… IHSG kembali mencapai rekor tertinggi lagi pada perdagangan Jumat, (8/4/2022) pada level 7.210,84 atau naik 83,47 poin (1,17%). MDKA, INCO, dan UNTR menjadi Top Gainer LQ45, sementara itu BUKA, ICBP, dan CPIN menjadi Top Losers LQ45 pada perdagangan hari Jumat, (8/4/2022).","Indeks Harga Saham Gabungan (IHSG) kembali meraih rekor tertinggi dengan tembus pada level 7.210,84 atau naik 83,47 poin (1,17%) pada penutupan perdagangan Jumat, (8/4/2022). Rekor sebelumnya terjadi pada hari Rabu (5/4/2022), dengan level 7.146. Sementara itu, menurut data RTI pangsa pasar IHSG pun telah tembus 9.077.384. Dalam sepekan, IHSG tercatat menguat 1,87%. Investor asing memborong saham PT Telkom Indonesia Tbk. (TLKM) dengan net buy Rp290,7 miliar dan disusul PT Bank Rakyat Indonesia Tbk. (BBRI) senilai Rp 178,2 miliar. Sementara itu, net sell terbesar pada saham PT Adaro Energy Tbk (ADRO) sebesar Rp 61,3 miliar; PT Sinar Mas Multiartha Tbk (SMMA) Rp 42,5 miliar dan PT Bumi Resources Tbk (BUMI) sebesar Rp 41,8 miliar. Total volume perdagangan saham di BEI hari Jumat mencapai 23,61 miliar dengan total nilai transaksi mencapai Rp 15,48 triliun. Ada 244 saham yang menguat, 253 saham yang melemah dan 193 saham yang stagnan. Top gainers LQ45 adalah: PT Merdeka Copper Gold Tbk (MDKA) 8,87% ke Rp 5.525 per saham PT Vale Indonesia Tbk (INCO) 5,57% ke Rp 7.575 per saham PT United Tractors Tbk (UNTR) 5,34% ke Rp 28.600 per saham Top Losers LQ45 adalah: PT Bukalapak.com Tbk (BUKA) 2,25% ke Rp 348 per saham PT Indofood CBP Sukses Makmur Tbk (ICBP) 1,65% ke Rp 7.450 per saham PT Charoen Pokphand Indonesia Tbk (CPIN) 0,90% ke Rp 5.500 per saham Beralih pada bursa asing, di mana mayoritas bursa saham Asia menguat. Tercatat, indeks Nikkei 225 (Jepang) naik 0,36 persen, indeks Hang Seng Composite (Hong Kong) naik 0,07 persen, dan indeks Kospi (Korea Selatan) naik 0,17 persen. Di Eropa, bursa saham juga perkasa sore ini. Terpantau, indeks FTSE 100 (Inggris) naik 1,09 persen, indeks CAC 40 (Perancis) naik 1,60 persen, dan indeks DAX (Jerman) naik 1,52 persen. Hal yang sama terjadi pada bursa saham Amerika, Indeks S&P 500 naik 0,43 persen, indeks NYSE menguat 0,27 persen, dan indeks NASDAQ naik 0,06 persen.","PT Telkom Indonesia Tbk. (TLKM), PT Bank Rakyat Indonesia Tbk. (BBRI), PT Adaro Energy Tbk (ADRO), PT Sinar Mas Multiartha Tbk (SMMA), PT Bumi Resources Tbk (BUMI), BEI, PT Merdeka Copper Gold Tbk (MDKA), PT Vale Indonesia Tbk (INCO), PT United Tractors Tbk (UNTR), PT Bukalapak.com Tbk (BUKA), PT Indofood CBP Sukses Makmur Tbk (ICBP), PT Charoen Pokphand Indonesia Tbk (CPIN)"
