date,label,category,title,mksa,content,harga yang dicari
3/3/2022,up,Finansial,"Harga gas naik, imbas perang Rusia-Ukraina",Intinya… Kenaikan harga gas beberapa minggu ke belakang disebabkan oleh suplai global yang tersendat dikarenakan eskalasi perang Rusia dan Ukraina yang semakin memanas. Patokan harga dunia juga perlahan naik dibanding rata-rata tahun kemarin.,"Kenaikan harga gas yang terjadi di produk gas elpiji non subsidi cukup meresahkan berbagai kalangan. Per 27 Februari, tabung ukuran 5 kilo dan 12 kilo sudah mendapat kenaikan menjadi Rp. 15.500,00 per Kg. Ini merupakan kenaikan harga elpiji non subsidi kedua sejak akhir Desember 2021 lalu. Harga perlahan merangkak naik dari yang sebelumnya 11.500 per Kg ke 13.500 per Kg dan sekarang di 15 ribu-an per Kg. Pjs. Corporate Secretary PT Pertamina Patra Niaga, Subholding Commercial & Trading Pertamina, Irto Ginting menjelaskan bahwa penyesuaian harga dilakukan karena mengikuti perkembangan terkini dari industri minyak dan gas. Harga acuan elpiji yaitu CP Aramco naik hingga mencapai US$ 775 per metrik ton pada Februari 2022 dibanding harga rata-rata sepanjang tahun 2021 yaitu US$ 637 per ton. Dikutip dari Tempo, salah seorang pedagang bernama Ricky Pratama sampai berkomentar: ""Cuma sultan yang bisa beli (gas non subsidi), para pelanggan juga mengeluh,"" ujarnya. Eskalasi Perang dan Kenaikan Harga sementara di belahan dunia lain, Presiden Amerika Serikat Joe Biden mengatakan bahwa sanksi yang diterapkan ke pihak Rusia seperti memotong bank-bank mereka dan lingkar oligarki dari sistem transaksi internasional SWIFT sebenarnya di desain untuk ‘tetap’ menjalankan bisnis energi (yang diantaranya termasuk gas). Namun kenyataan berkata lain karena harga gas alam di Eropa naik dalam beberapa pekan ke belakang. Rusia menjadi menjadi negara kedua terbesar eksportir minyak mentah dan minyak olahan (termasuk bensin) dan juga eksportir terbesar gas alam yang sebagian besar dialirkan melalui pipa gas ke Eropa Barat. Secara garis besar, pihak Eropa dan aliansinya ingin agar mereka membuat tekanan bagi Rusia namun yang terjadi malah krisis energi yang melanda kawasan Eropa. Dalam sektor lain, pihak-pihak logistik, pebisnis, dan asuransi ‘enggan’ untuk mengambil resiko dan terlibat dalam soal mengurusi kargo Rusia. Mereka takut akan serangan frontal, masalah pembayaran yang tersendat, tidak sampainya barang hingga opini publik yang buruk. Buntut dari masalah ini juga menyentuh ke saham. Salah satu perusahaan terkemuka Shell menyatakan akan membatalkan ‘joint ventures’ mereka dengan perusahaan gas besar Rusia Gazprom.",gas
4/3/2022,down,Finansial,Negara-negara Barat seperti “Mencoba Menghancurkan” Ekonomi Rusia,"Intinya… Negara-negara G7 menjatuhkan sanksi yang belum pernah diberikan sebelumnya ke Bank Sentral Rusia, disertai tindakan oligarki dari negara barat lain. Perdana Menteri Perancis, Bruno Le Maire mengatakan tujuan dari sanksi ronde terakhir adalah untuk melumpuhkan ekonomi Rusia.","Negara-negara barat telah menanggapi keras invasi Rusia atas Ukraina. Tanggapan keras ini berupa berbagai sanksi yang bertujuan melumpuhkan ekonomi Rusia. Para ahli ekonomi menanggapi tindakan tersebut bisa berhasil. G7 telah memberikan sanksi ekonomi bertubi-tubi pada Rusia melalui Bank Sentral Rusia. Berbagai bank besar di Rusia sudah dilarang dari sistem pembayaran internasional SWIFT. Larangan ini bertujuan untuk mencegah berbagai bank tersebut berkomunikasi dalam jaringan yang aman antar bank di seluruh dunia. Tindakan ini tidak lain dan tidak bukan untuk mengucilkan perekonomian Rusia dari dunia. Mereka juga secara efektif melarang investor Barat melakukan bisnis dengan bank sentral dan membekukan aset luar negerinya, paling tidak cadangan mata uang asing yang sangat besar yang telah digunakan CBR sebagai penyangga terhadap depresiasi aset lokal. Menteri Keuangan Prancis Bruno Le Maire pada hari Selasa mengatakan kepada stasiun radio Prancis bahwa tujuan dari putaran terakhir sanksi adalah untuk “menyebabkan runtuhnya ekonomi Rusia.” Rubel Rusia telah jatuh sejak Rusia menginvasi tetangganya pekan lalu dan mencapai titik terendah sepanjang masa di 109,55 terhadap dolar pada Rabu pagi. Saham Rusia juga mengalami aksi jual besar-besaran. Bursa saham Moskow ditutup untuk hari ketiga berturut-turut pada hari Rabu karena pihak berwenang berupaya untuk membendung penurunan harga aset lokal. Sementara itu, pemberi pinjaman terbesar di negara itu, Sberbank , keluar dari operasinya di Eropa dan melihat sahamnya yang terdaftar di London turun lebih dari 95% untuk diperdagangkan pada satu sen. Saham pemain utama negara lainnya di Bursa Efek London, termasuk Rosneft dan Lukoil, juga ambruk. Ekonom Swedia dan mantan rekan senior Dewan Atlantik Anders Aslund melalui twitter pada hari Rabu, mencuitkan bahwa sanksi Barat secara efektif “menghancurkan keuangan Rusia dalam satu hari”. “Situasinya kemungkinan akan menjadi lebih buruk daripada tahun 1998 karena sekarang tidak ada akhir yang positif. Semua pasar modal Rusia tampaknya akan musnah & mereka tidak mungkin kembali dengan sesuatu yang kurang dari reformasi yang mendalam,” tambahnya. Goldman Sachs telah menaikkan perkiraan akhir tahun untuk inflasi Rusia menjadi 17% YoY dari proyeksi sebelumnya sebesar 5%, dengan risiko condong ke sisi atas mengingat rubel dapat dijual lebih lanjut, atau CBR mungkin terpaksa menaikkan suku bunga lebih banyak untuk menjaga stabilitas. Pertumbuhan ekonomi juga diperkirakan akan terpukul parah, dan raksasa Wall Street itu memangkas perkiraan PDB (produk domestik bruto) 2022 dari ekspansi 2% menjadi kontraksi 7% tahun ke tahun, meskipun Grafe mengakui ketidakpastian seputar angka-angka ini.",
5/3/2022,up,Finansial,Harga Minyak Mentah Indonesia melesat sebesar US$ 9.83 per barel,"Intinya... Jadi, harga minyak mentah Indonesia mengalami kenaikan dari dari US$ 85,98 pada Januari 2022 menjadi US$ 95.72 menurut keputusan Kementrian ESDM pada Bulan Februari 2022. Kenaikan itu dipicu dengan faktor meningkatnya harga minyak mentah yang dipengaruhi permintaan minyak mentah dunia, dan tegangnya perang Rusia Ukraina serta redanya pandemi Covid-19 menjadi alasan adanya peningkatan proyeksi pertumbuhan tahunan permintaan minyak dunia.","Indonesia Crude Price (ICP) atau harga minyak mentah Indonesia mengalami kenaikan pada Februari 2022. Harga minyak mentah Indonesia naik sebesar US$ 9.83, dari US$ 85,98 pada Januari 2022 menjadi US$ 95.72. Invasi Rusia pada Ukraina menambah kekhawatiran akan semakin terganggunya pasokan energi global. Perkembangan tersebut mendorong harga rata-rata minyak mentah utama di pasar internasional pada bulan Februari 2022. Kementrian ESDM menetapkan kenaikan tersebut pada Keputusan Menteri Energi dan Sumber Daya Mineral Nomor 18.K/MG.03/DJM/2022 tentang Harga Minyak Mentah Indonesia Bulan Februari 2022, yang ditetapkan tanggal 1 Maret 2022. Faktor meningkatkan harga minyak mentah tersebut, merupakan efek dari peningkatkan harga minyak mentah utama juga dipengaruhi permintaan minyak dunia mengutip dari Executive Summary, Tim Harga Minyak Mentah Indonesia. Berdasarkan laporan IEA (International Energy Agency) pada bulan Februari 2022, terdapat peningkatan proyeksi pertumbuhan tahunan permintaan minyak dunia tahun 2022 sebesar 3,2 juta barel per hari menjadi 100,6 juta barel per hari yang dipicu oleh meredanya pembatasan Covid-19. Adapun perkembangan harga rata-rata minyak mentah dunia pada bulan Februari 2022 dibandingkan bulan Januari 2022 sebagai berikut: Dated Brent naik sebesar US$10,97 per barel dari US$87,22 per barel menjadi US$98,19 per barel WTI (Nymex) naik sebesar US$8,65 per barel dari US$82,98 per barel menjadi US$91,63 per barel Brent (ICE) naik sebesar US$8,53 per barel dari US$85,57 per barel menjadi US$94,10 per barel Basket OPEC naik sebesar US$8,83 per barel dari US$85,13 per barel menjadi US$93,96 per barel Lalu, berdasarkan Laporan Mingguan U.S. Energy Information Administration (EIA), terdapat penurunan stok Amerika Serikat pada akhir Februari 2022 dibandingkan akhir bulan sebelumnya yaitu stok gasoline turun 3,5 juta barel menjadi 246,5 juta barel, stok distillate turun 3,0 juta barel menjadi 119,7 juta barel. Sementara itu, kawasan Asia Pasifik memiliki faktor lain, harga minyak mentah juga dipengaruhi oleh peningkatan estimasi troughput 35 kilang gabungan di China yang terdiri dari kilang Sinopec, China National Offshore Oil Corporation (CNOOC), Petrochina dan Sinochem Corp, pada bulan Februari 2022 sebesar 3,2 persen dibandingkan bulan lalu menjadi 7,2 juta barel per hari. “Jepang kembali melanjutkan pemberian subsidi gasoline sebesar 5 yen per liter kepada distributor minyak. Pemberian subsidi telah dilaksanakan sejak 27 Januari 2022 melalui evaluasi penetapan yang dilakukan setiap minggu sebagai upaya Pemerintah untuk menjaga harga retail gasoline yang tinggi di negara tersebut,” lebih lanjut.",minyak mentah
6/3/2022,up,Finansial,"Penelitian tentang hubungan antara manusia dan hewan peliharaannya semakin banyak selama pandemi, ini hasilnya!","Intinya... Memiliki hewan peliharaan tentu krusial untuk menjaga pikiran tetap positif saat isolasi interaksi sosial yang terjadi selama masa pandemi, namun bila kita memiliki tanggungan lain, hal sebaliknya bisa terjadi.","Banyak dari kita mengandalkan hewan peliharaan kita untuk mencerahkan suasana hati kita dan meredakan ketegangan selama tekanan pandemi yang mengepul selama dua tahun terakhir. Penelitian tentang ikatan antara hewan peliharaan-manusia telah berkembang pesat selama pandemi, dan penelitian menunjukkan bahwa pemilik hewan peliharaan sering mengatakan bahwa hewan peliharaan mereka telah mengurangi kesepian, memberikan dukungan emosional yang sangat dibutuhkan dan memiliki dampak keseluruhan yang positif pada kesehatan mereka. Tetapi ketika sampai pada sains definitif tentang peran yang dimainkan hewan peliharaan selama pandemi, pesannya masih belum jelas. ""Ini semacam campuran baik dan buruk, jujur. Pemilik hewan peliharaan merasakan dampak positif, tetapi ketika Anda benar-benar mengukur tingkat stres atau gejala depresi mereka, Anda tidak melihat efek apa pun, (yang menunjukkan rendahnya tingkat stres)"" kata ilmuwan perkembangan Megan Mueller, yang ikut mengarahkan penelitian tersebut. Tufts Institute for Human-Hewan Interaction dan memimpin Lab Tufts Pets and Well-Being. Sejumlah penelitian menemukan hasil kesehatan yang menguntungkan bagi pemilik anjing yang lebih sering berjalan-jalan dan menghabiskan waktu di luar. Tetapi penelitian lain menemukan pemilik hewan peliharaan memiliki stres yang lebih tinggi dan lebih banyak depresi daripada pemilik non-hewan peliharaan. Itu mungkin dijelaskan oleh keadaan unik individu, kata Mueller, yang saat ini sedang mempersiapkan tinjauan sistematis penelitian hewan peliharaan pandemi untuk dipublikasikan. ""Jika Anda adalah seseorang yang tinggal sendirian dan terisolasi secara sosial selama pandemi, memiliki hewan peliharaan mungkin sangat penting,"" kata Mueller, yang merupakan profesor di Cummings School of Veterinary Medicine di Tufts University. Namun Ia juga menambahkan ""Jika Anda adalah orang tua dari anak-anak dan Anda menangani pekerjaan, sekolah virtual, dan penitipan anak, Anda mungkin tidak memiliki kebutuhan interaksi sosial yang sama dan beban merawat hewan peliharaan mungkin lebih tinggi."" Jadi ini benar benar tergantung dari situasi individu, serta apakah individu tersebut terisolasi secara interaksi sosial. Kondisi ekonomi juga mempengaruhi tingkat kebahagiaan hubungan manusia dengan hewan peliharaannya. Banyak keluarga berpenghasilan rendah yang terjebak dalam ketidakpastian ekonomi selama dua tahun terakhir mungkin tidak memiliki sarana untuk menyediakan perawatan hewan dan perawatan lain yang dibutuhkan untuk hewan mereka – apalagi diri mereka sendiri dan keluarga mereka. Penelitian baru tentang peran hewan peliharaan selama pandemi diterbitkan setiap hari, kata Mueller, dan dia berharap sains akan dapat mengungkap beberapa nuansa bagaimana hewan peliharaan kita membantu kita selama masa yang belum pernah terjadi sebelumnya ini.",hewan peliharaan (CPRO)
6/3/2022,up,Finansial,Harga Emas capai 1 Juta per Gram bikin rencana kedepan,"Intinya… Harga emas mengalami kenaikan dan mencapai 1 juta per gram, sehingga bisa menjadi pilihan investasi yang perlu dipertimbangkan karena termasuk aset yang aman dan memiliki risiko yang bisa di-manage jika punya tujuan investasi yang jelas.","Harga produksi PT Aneka Tambang atau Antam mengalami kenaikan sebesar Rp15.000. Kenaikan ini membuat harga emas hari ini berada di level Rp1,05 juta per gram. Sementara itu, harga jual kembali atau buy back juga mengalami kenaikan sebesar Rp17.000. Dengan demikian, harga buy back emas Antam saat ini adalah Rp912 ribu per gram. 1. Harga emas batangan Antam dalam pecahan lain Berikut ini harga emas batangan Antam per hari ini dalam pecahan lain: Harga emas 0,5 gram: Rp552,5 ribu; 1 gram: Rp1,05 juta; 2 gram: Rp1,950 juta; 3 gram: Rp2,9 juta; 5 gram: Rp4,8 juta; 10 gram: Rp9,545 juta; 25 gram: Rp23,737 juta; 50 gram: Rp47,395 juta; 100 gram: Rp94,712 juta. Harga jual emas tersebut belum termasuk Pajak Penghasilan (PPh) 22 atas emas batangan sebesar 0,45 persen bagi pemegang Nomor Pokok Wajib Pajak (NPWP). Bagi pembeli yang tidak menyertakan NPWP memperoleh potongan pajak lebih tinggi sebesar 0,9 persen. 2. Emas jadi aset aman investasi Emas bisa menjadi instrumen yang sangat berguna untuk mendiversifikasi portofolio investasi. Selain karena merupakan logam mulia yang banyak diminati, nilai emas juga cenderung bertolak belakang dengan aset investasi lain seperti ekuitas atau properti. Dengan demikian, di saat harga saham atau properti turun, nilai emas kemungkinan besar akan naik sehingga investor yang telah mendiversifikasi investasinya ke emas bisa bernapas lega karena tidak semua aset yang dimilik melemah nilainya. Emas juga bisa disebut sebagai asuransi untuk portofolio seorang investor, sehingga setiap investor setidaknya harus mengalokasikan sekitar 5 hingga 15 persen dari portofolio mereka untuk investasi terkait emas. 3. Tentukan dulu tujuan investasimu sebelum membeli emas Berinvestasi emas sering kali menjadi pilihan, terutama bagi para investor konservatif. Selain mudah, investasi emas juga cenderung aman. Sebab, risiko yang dimiliki tidak setinggi investasi pada instrumen saham. Nah, sebelum kamu memulai investasi, tentukan lebih dulu apa tujuan investasimu. Jika investasi untuk jangka pendek, tentu instrumen emas tidak cocok karena ada selisih harga jual dan harga beli. Alih-alih untung, kamu bisa merugi. Sebaliknya, jika kamu berinvestasi untuk jangka panjang, emas jadi instrumen yang cocok. Sebab, kamu akan mendapatkan keuntungan yang cukup signifikan.",emas
7/3/2022,up,Finansial,Auto Cuan dengan IPO Nanotech ?,"Intinya… PT Nano Herbaltama Internasional (NHI) yang merupakan anak perusahaan PT Nanotech Indonesia Global Tbk (NIG) akan berencana melantai Bursa Efek Indonesia (BEI) pada Maret 2022 dengan melepas 1.285.000.000 saham atau setara dengan sekitar 29,99% dari milik perusahaan dengan harga Rp 100 per saham atau Rp 10.000 per lot.","Halo teman - teman PukulEnam! Kayaknya buat temen - temen yang sering belajar saham dan crypto udah gampang ya melihat potensi yang bisa diambil sekarang - sekarang ini. Dengan ada nya perang antara Rusia dan Ukraina, terdapat banyak sekali kesempatan, apalagi bila dilihat dari segi komoditas, baik dari emas, nikkel, hingga batu bara. Tapi kali ini kita akan bahas satu sektor yang rasanya sudah hilang di permukaan dikarenakan oleh berita - berita perang ini. Yak, benar sekali, sektor kesehatan, harusnya sih teman - teman udah ga asing lagi ya dengan sektor ini. Pada tahun 2020 ketika pertama kali diumumkan kasus pertama COVID-19, IHSG semakin hari semakin turun, hingga mencapai level terendah, yaitu hingga di 3936. Salah satu sektor yang bertahan dalam kehancuran market itu adalah sektor kesehatan. Kesempatan dan potensi yang sama terlihat pula di saat ini. Melihat naiknya kasus pada COVID-19, terutama pada varian terbaru yaitu Omicron. ""Pada masa pandemi COVID-19, permintaan terhadap produk-produk untuk meningkatkan imunitas dan pencegahan penyakit meningkat relatif tinggi, salah satunya permintaan terhadap produk propolis,"" ujar Komisaris Utama PT Nanotech Indonesia Global Tbk (NIG), Nurul Taufiqu Rochman, dalam keterangan tertulis, Minggu (6/3/2022). PT Nano Herbaltama Internasional (NHI) yang merupakan anak perusahaan PT Nanotech Indonesia Global Tbk (NIG) dan NHI memiliki satu pabrik yang memiliki fasilitas Cara Pembuatan Obat Tradisional yang Baik (CPOTB) di Jawa Barat. Hal ini dianggap menjadi jendela omset yang dapat mencapai milliaran. ""Omzet propolis cukup tinggi, potensinya bisa mencapai Rp 20 miliar per tahun, sedangkan metode produksi berbasis riset Nanoteknologi tersebut berpotensi untuk dipatenkan yang akan berlaku selama 20 tahun,"" kata Nurul. Tentunya, hal ini didasarkan oleh prospek pertumbuhan ekonomi dan teknologi Indonesia di kemudian hari. ""Pada masa mendatang, permintaan di sektor kesehatan, farmasi dan kecantikan akan terus meningkat sejalan dengan kebangkitan perekonomian Indonesia menyongsong negara maju,"" kata Nurul. NIG berencana melantai bursa pada Maret 2022 dengan mekanisme penawaran umum perdana atau IPO dengan kode saham NANO. NIG berencana untuk melepaskan dengan melepas 1.285.000.000 saham atau setara dengan sekitar 29,99% dari perusahaan tersebut dan tentunya dengan harga Rp 100 per saham atau Rp 10.000 per lot. Dana yang didapat dari penawaran umum ini diperkirakan mencapai Rp 128,5 miliar. Nah kira - kira bagaimana dengan dana yang didapat dari bursa? ""Dana yang terhimpun untuk meningkatkan kinerja perseroan, termasuk untuk lini usaha farmasi dan obat herbal,"" ujar Suryandaru, Direktur Utama Nanotech Indonesia Global. Dengan melihat prospek dari perseroan, sebesar Rp 16,7 miliar dana dari hasil IPO akan digunakan untuk keperluan modal berupa mesin dan perlengkapan yang akan digunakan oleh NIG dalam pelayanan teknologi kesehatan, kosmetik, dan farmasi. Tentunya tak lupa untuk pengembangan perusahaan sendiri. Nah, sekarang, bagaimana menurut teman - teman sendiri? Keknya bakal cuan ga sih kalau beli NANO pas IPO?",pt nano herbaltama internasional
10/3/2022,up,Finansial,Kelanjutan tutupnya perusahaan besar dan peluang investasi di Rusia,"Intinya...Rusia akan menjadi negara tersehat, ter-edukasi, dan ter-lurus di planet bumi dalam beberapa minggu ke depan. Hal tersebut dikarenakan beberapa gerai waralaba junk food, media, dan situs porno berhenti beroperasi di Rusia. Ini tentu hanya lelucon namun juga memunculkan peluang investasi.","Kepergian perusahaan-perusahaan besar beberapa minggu belakang yang terjadi di Rusia masih berlanjut hingga sekarang. McDonald baru-baru ini memberhentikan sementara bisnis mereka di 850 lokasi, Starbucks akan menutup 100 kedainya, dan terakhir Coca-Cola yang 2% pendapatan dan pendapatan operasional perusahaan nya berasal dari Rusia juga melakukan hal yang serupa. CEO Mcdonald Chris Kempczinski yang menulis surat kepada pemegang waralaba dan karyawan mengatakan bahwa: “Dalam tiga puluh tahun lebih McDonald's beroperasi di Rusia, kami telah menjadi bagian penting dari 850 komunitas tempat kami beroperasi. Pada saat yang sama, nilai-nilai kami mengajarkan bahwa kami tidak dapat mengabaikan penderitaan manusia yang tidak perlu terjadi di Ukraina” Ia juga berjanji akan terus membayar 62.000 pekerjanya di Rusia dan menyumbangkan US$ 5 juta untuk dana bantuan karyawannya yang berada di Ukraina.Lelucon dan Opini Beberapa lelucon yang beredar seputaran keadaan ini kurang lebih berisi: “Jika mereka terus mendapatkan sanksi, masyarakat Rusia akan menjadi orang-orang tersehat, ter-lurus, dan paling ter-edukasi di planet bumi” ujar akun Twitter terkenal @1Fubar yang dikutip oleh media GB News. Bagaimana tidak, selain beberapa gerai FnB di atas, PornHub dan CNN juga telah menghentikan pelayanan mereka di Rusia. Ke-tabuan pun sedang terjadi karena kedua negara yang sama-sama menggunakan ‘topi pesta’ McDonald (dan sama-sama penganut paham demokrasi) sekarang sedang berperang. Dalam artikel Bloomberg Opinion berikut, Matt Levine menyimpulkan hanya ada dua alasan penting untuk menghentikan bisnis di Rusia: Moral reasons Hal ini berkaitan erat dengan sudut pandang CEO dan juga tekanan dari pemegang saham, karyawan, dan konsumen. Namun ini juga bisa menjadi serangan balik karena ada biaya kesempatan (opportunity cost) yang berbentuk ‘agresi’ yang akan dihasilkan oleh konsumen anda di Rusia. Dalam sudut pandang bisnis ESG (Environmental, Social, and Governance) seperti minyak dan gas ini merupakan pilihan yang tepat karena anda berurusan dengan pemerintah sedang dalam sudut non-ESG, anda bisa mengambil resiko untuk invest misal di saham-saham Rusia yang kena diskon. Ingat high risk high return formula (dan juga jika anda tidak peduli benar soal menjadi seorang ‘polisi’ moral). Risk reasons Ini sudah jelas karena ada faktor resiko yang terjadi sekarang. Jika memang ada aset dan bangunan yang sedang dibangun sekarang di Kremlin, kemungkinan besar itu semua akan disita oleh pihak Rusia dan masyarakatnya pun tidak akan mempunyai daya beli apa-apa (dikarenakan inflasi dan lain-lain). Terlepas dari dua alasan tersebut, jangan lupa dahulu pada Perang Dunia Kedua pihak USA meminta bantuan mafia Italia untuk membantu mereka di Sisilia. Terkadang peluang investasi juga mungkin ada di saat seperti ini.",pasar modal rusia ?
11/3/2022,down,Finansial,"Jangan isi asal-asalan SPT tahunan, Kamu Bisa Dipidana!","Intinya… Batas waktu pengisian dan pelaporan SPT Tahunan sudah mau berakhir. Dan ternyata, keterlambatan pengisian dan pelaporan, kesengajaan tidak melapor, hingga mengisi dengan asal-asalan bisa kena sanksi, loh. Bahkan, bisa kena sanksi pidana juga.","Bulan Maret mungkin menjadi bulan yang cukup bikin malas bagi sebagian orang. Apakah kamu termasuk? Hal ini berkaitan dengan batas akhir pengisian Surat Pemberitahuan atau SPT Tahunan untuk pelaporan pajak. ebenarnya, SPT Tahunan untuk Wajib Pajak (WP) orang pribadi sudah bisa mulai dilakukan sejak awal tahun, 1 Januari 2022. Namun, tidak jarang orang-orang baru ramai mengisi SPT dan melaporkan pajak mereka di batas akhir pelaporan, yakni menjelang 31 Maret 2022. Beberapa hal yang membuat orang malas untuk melapor terkadang berkaitan dengan sistem pelaporannya, baik dari bagaimana pengisiannya hingga sistem online yang mungkin masih membuat sebagian orang bingung. Meski merasa malas dan bingung, kamu tetap harus melaporkan pajak dengan pengisian SPT tahunan, tidak boleh dengan sengaja tidak melaporkan. Lalu, pengisian SPT tahunan ini juga tidak boleh asal-asalan. Ternyata, permasalahan pengisian SPT yang asal-asalan dan kesengajaan tidak melapor ini sudah dibahas di Undang-Undang, dan ada sanksi pidananya loh. “Undang-Undang juga mengatur dapat dikenakan sanksi pidana bila terbukti dengan sengaja tidak melaporkan SPT, atau melaporkan SPT tetapi isinya tidak benar atau sengaja tidak melaporkan penghasilannya, atau tidak lengkap,” ujar Neil selaku Direktur Penyuluhan, Pelayanan, dan Humas DJP, yang dikutip dari Kompas.com (10/03/2022). Selain sanksi pidana, pastinya ada sanksi denda yang jelas akan dilayangkan pada WP yang melanggar. WP yang terlambat atau tidak melaporkan SPT tahunannya akan menerima denda sebesar Rp 100.000 sebagaimana diatur dalam Pasal 77 Undang-Undang Ketentuan Umum dan Tata Cara Perpajakan. Akan dikeluarkan Surat Tagihan Pajak (STP) untuk meminta denda keterlambatan melapor. Alurnya seperti ini: 7 hari setelah STP dikeluarkan dan WP masih belum membayar denda keterlambatan ataupun melunasi utang pajak, maka akan diterbitkan Surat Teguran. Setelah 21 hari sejak Surat Teguran diberikan dan WP masih belum ada itikad baik, maka DJP (Direktorat Jenderal Pajak) akan mengeluarkan Surat Paksa. P akan diberikan waktu 2x24 jam untuk melunai utang pajak setelah Surat Paksa dilayangkan. Bila tetap tidak ada pergerakan dari WP, maka DJP akan menerbitkan Surat Perintah Melaksanakan Penyitaan, dan Juru Sita Pajak akan melakukan penyitaan terhadap barang milik Penanggung Pajak",
